{
  "version": "0.1.0",
  "source": {
    "base": "fixture-base",
    "head": "fixture-head",
    "repo_root": null,
    "head_tree": null
  },
  "units": [
    {
      "id": "path:src/core/solver.rs",
      "path": "src/core/solver.rs",
      "status": "modified",
      "kind": "behavior",
      "family": "core",
      "notes": []
    },
    {
      "id": "path:src/git/ingest.rs",
      "path": "src/git/ingest.rs",
      "status": "modified",
      "kind": "behavior",
      "family": "git",
      "notes": []
    },
    {
      "id": "path:README.md",
      "path": "README.md",
      "status": "modified",
      "kind": "documentation",
      "family": "root",
      "notes": []
    }
  ],
  "slices": [
    {
      "id": "behavior-core",
      "title": "Behavior: core",
      "kind": "behavior",
      "families": [
        "core"
      ],
      "members": [
        "path:src/core/solver.rs"
      ],
      "depends_on": [],
      "reasons": [
        {
          "code": "fixture",
          "message": "Pinned by fixture expectation."
        }
      ],
      "proof_surface": {
        "scenario_ids": [
          "05-ambiguous-root-doc"
        ],
        "expected_commands": [
          "cargo test --workspace"
        ]
      }
    },
    {
      "id": "behavior-git",
      "title": "Behavior: git",
      "kind": "behavior",
      "families": [
        "git"
      ],
      "members": [
        "path:src/git/ingest.rs"
      ],
      "depends_on": [],
      "reasons": [
        {
          "code": "fixture",
          "message": "Pinned by fixture expectation."
        }
      ],
      "proof_surface": {
        "scenario_ids": [
          "05-ambiguous-root-doc"
        ],
        "expected_commands": [
          "cargo test --workspace"
        ]
      }
    },
    {
      "id": "tests-docs-root",
      "title": "Docs/tests: root",
      "kind": "tests-docs",
      "families": [
        "root"
      ],
      "members": [
        "path:README.md"
      ],
      "depends_on": [],
      "reasons": [
        {
          "code": "fixture",
          "message": "Pinned by fixture expectation."
        }
      ],
      "proof_surface": {
        "scenario_ids": [
          "05-ambiguous-root-doc"
        ],
        "expected_commands": [
          "cargo test --workspace"
        ]
      }
    }
  ],
  "ambiguities": [
    {
      "id": "ambiguity-readme-md",
      "message": "README.md changed with multiple behavior families and cannot be attached confidently in v0.1.",
      "affected_units": [
        "path:README.md"
      ],
      "candidate_slices": [
        "behavior-core",
        "behavior-git"
      ],
      "resolution": "Left as a standalone docs/tests slice. Use override.toml to attach explicitly."
    }
  ],
  "diagnostics": []
}