{
  "version": "0.1.0",
  "source": {
    "base": "fixture-base",
    "head": "fixture-head",
    "repo_root": null,
    "head_tree": null
  },
  "units": [
    {
      "id": "path:Cargo.toml",
      "path": "Cargo.toml",
      "status": "modified",
      "kind": "manifest",
      "family": "workspace",
      "notes": []
    },
    {
      "id": "path:Cargo.lock",
      "path": "Cargo.lock",
      "status": "modified",
      "kind": "lockfile",
      "family": "workspace",
      "notes": []
    },
    {
      "id": "path:src/cli/main.rs",
      "path": "src/cli/main.rs",
      "status": "modified",
      "kind": "behavior",
      "family": "cli",
      "notes": []
    }
  ],
  "slices": [
    {
      "id": "api-schema-workspace",
      "title": "Manifest and lockstep package metadata",
      "kind": "api-schema",
      "families": [
        "workspace"
      ],
      "members": [
        "path:Cargo.toml",
        "path:Cargo.lock"
      ],
      "depends_on": [],
      "reasons": [
        {
          "code": "fixture",
          "message": "Pinned by fixture expectation."
        }
      ],
      "proof_surface": {
        "scenario_ids": [
          "03-manifest-lockfile"
        ],
        "expected_commands": [
          "cargo test --workspace"
        ]
      }
    },
    {
      "id": "behavior-cli",
      "title": "Behavior: cli",
      "kind": "behavior",
      "families": [
        "cli"
      ],
      "members": [
        "path:src/cli/main.rs"
      ],
      "depends_on": [
        "api-schema-workspace"
      ],
      "reasons": [
        {
          "code": "fixture",
          "message": "Pinned by fixture expectation."
        }
      ],
      "proof_surface": {
        "scenario_ids": [
          "03-manifest-lockfile"
        ],
        "expected_commands": [
          "cargo test --workspace"
        ]
      }
    }
  ],
  "ambiguities": [],
  "diagnostics": []
}
